{
  "requestId": "pong-request-healthy-001",
  "runId": "pong-autonomous-run-001",
  "status": "completed",
  "details": "Autonomous run completed.",
  "timestamp": "2026-04-17T17:55:00Z",
  "controlPath": "file_broker",
  "evidenceRefs": [
    "examples/pong-testbed/harness/expected-evidence-manifest.json"
  ]
}
